{
  "contract_name": "reason.code.compatibility",
  "contract_version": "1.0.0",
  "schema_version": "1.0.0",
  "tenant_id": "tenant-lab-001",
  "customer_context_id": "customer-context-main",
  "environment": "dry_run",
  "correlation_id": "corr-reason-compat-deprecate-alias-001",
  "causation_id": "taxonomy-change-request-002",
  "idempotency_key": "idem-reason-compat-deprecate-alias-001",
  "producer": {
    "component": "security_reviewer",
    "produced_at": "2026-05-24T21:25:00Z"
  },
  "policy_version": "policy-phase0-v1",
  "taxonomy_version": "taxonomy-reason-v2",
  "compatibility_record_id": "rc-compat-002",
  "reason_code": "export_delete_conflict_active",
  "previous_reason_code": "export_delete_review_required",
  "compatibility_action": "alias",
  "compatibility_status": "compatible",
  "migration_required": true,
  "migration_notes": "Normalize legacy code to canonical conflict-active code for metadata display.",
  "affected_contracts": [
    "governance.audit_export",
    "governance.export_delete_review",
    "evidence.export_manifest"
  ],
  "evidence_refs": [
    "ev-reason-compat-deprecate-alias-001"
  ],
  "created_at": "2026-05-24T21:25:00Z"
}
