{
  "contract_name": "reason.code.compatibility",
  "contract_version": "1.0.0",
  "schema_version": "1.0.0",
  "tenant_id": "tenant-lab-001",
  "customer_context_id": "customer-context-main",
  "environment": "blocked_mvp",
  "correlation_id": "corr-reason-compat-breaking-blocked-001",
  "causation_id": "taxonomy-change-request-003",
  "idempotency_key": "idem-reason-compat-breaking-blocked-001",
  "producer": {
    "component": "compliance_reviewer",
    "produced_at": "2026-05-24T21:30:00Z"
  },
  "policy_version": "policy-phase0-v1",
  "taxonomy_version": "taxonomy-reason-v3",
  "compatibility_record_id": "rc-compat-003",
  "reason_code": "blocked_mvp_export_delete_execution",
  "previous_reason_code": "export_delete_blocked_mvp",
  "compatibility_action": "remove_planned",
  "compatibility_status": "breaking_change",
  "migration_required": true,
  "migration_notes": "Breaking removal plan is blocked pending policy review and full migration proof.",
  "affected_contracts": [
    "governance.audit_export",
    "governance.export_delete_review",
    "evidence.export_manifest",
    "console.alert",
    "supervisor.health"
  ],
  "evidence_refs": [
    "ev-reason-compat-breaking-blocked-001"
  ],
  "created_at": "2026-05-24T21:30:00Z"
}
